Year,State,Metadata
2009,Tennessee,"Utility District Natural Gas Fueling Station Regulation, Utility districts may own and operate natural gas fueling stations if
the operation of the station is not franchised to another entity. This
regulation does not prohibit private companies from owning or operating
natural gas fueling stations within a utility district service area.

(Reference [Tennessee Code 7-82-302](https://www.tncourts.gov/Tennessee%20Code)), Laws and Regulations, 32.0, NG, REGIS, STATION, https://www.tncourts.gov/Tennessee%20Code, enacted"
2009,Tennessee,"Biofuel Blending Contract Regulation, Any provision in a contract between a fuel wholesaler and a refiner or
supplier that limits or restricts the wholesaler's ability to blend
petroleum products with ethanol or biodiesel is null and void.

(Reference [Tennessee Code 47-25-2004](https://www.tncourts.gov/Tennessee%20Code)), Laws and Regulations, 35.0, BIOD|ETH, OTHER, STATION|AFP, https://www.tncourts.gov/Tennessee%20Code, enacted"
2009,Ohio,"Alternative Fuel Signage, The Ohio Turnpike Commission allows businesses to place their logos on
directional signs within the right-of-way of state turnpikes. An
alternative fuel retailer may include a marking or symbol within their
logo indicating that it sells one or more types of alternative fuel.
Alternative fuels are defined as any fuel containing 85% or more ethanol
(E85), fuel blends containing at least 20% biodiesel (B20), natural gas,
propane, hydrogen, electricity, or any fuel that the U.S. Department of
Energy has determined is substantially not petroleum. For more
information, see the Ohio Turnpike Commission
[website](https://www.ohioturnpike.org/home).

(Reference [Ohio Revised Code 125.831 and 5537.30](https://codes.ohio.gov/ohio-revised-code)), Laws and Regulations, 55.0, BIOD|ETH|ELEC|HY|NG|PHEV|LPG, OTHER, STATION|PURCH, https://codes.ohio.gov/ohio-revised-code, enacted"
2011,South Dakota,"Biofuel Franchising Contract Regulations, Franchise documents may not restrict a franchisee from participating in
any of the following activities:

-   Installing a biofuel pump or tank, except property leased from the
    franchisor;
-   Converting an existing tank or pump for biofuels use;
-   Advertising the sale of biofuels, including listing biofuel
    availability or prices on signage;
-   Selling biofuels;
-   Purchasing biofuel from other sources if the franchisor does not
    offer biofuel;
-   Installing or operating an ethanol blender pump, if the pump is
    approved for use by the appropriate jurisdictional authority; or
-   Selling a biofuel in place of one grade of gasoline, if the
    franchisee is required to sell three grades of gasoline.

Biofuels include biodiesel, biodiesel blends, ethanol, and ethanol
blends.

(Reference [South Dakota Statutes 37-2-34 through 37-2-37](https://sdlegislature.gov/Statutes)), Laws and Regulations, 60.0, BIOD|ETH, OTHER, STATION, https://sdlegislature.gov/Statutes, enacted"
,Rhode Island,"Emissions Control Requirement, Heavy-duty diesel vehicles used to perform federally funded state public
works contracts must be powered by engines with Level 3 emissions
control devices that are properly operated and maintained. If the Rhode
Island Department of Environmental Management determines that no
verified Level 3 devices are appropriate on particular engines, Level 2
devices are required. Likewise, if no verified Level 2 devices are
appropriate, Level 1 devices are required. Exceptions to this
requirement include, but are not limited to, snow removal vehicles and
equipment, farm equipment, emergency response vehicles, standby
generators, and vehicles used on a project for less than 30 total work
days over the life of the project.

(Reference [Rhode Island General Laws 31-47.3-5](http://webserver.rilin.state.ri.us/Statutes/)), Laws and Regulations, 45.0, IR, AIRQEMISSIONS|DREST, FLEET|GOV, http://webserver.rilin.state.ri.us/Statutes/, amended"
2011,Oregon,"Commercial Vehicle Idle Reduction Requirement, A driver of a commercial vehicle may not idle the engine for more than
five minutes in any sixty-minute period, unless the vehicle is using an
auxiliary power unit, generator set, cargo temperature control unit, or
other idle reduction technology that maintains heat or air conditioning
or provides electrical power. Exceptions apply in certain situations and
for certain vehicles.

(Reference [Oregon Revised Statutes 825.605 through 825.610](https://www.oregonlegislature.gov/)), Laws and Regulations, 80.0, IR, AIRQEMISSIONS|DREST, FLEET|GOV, https://www.oregonlegislature.gov/, enacted"
2012,Oregon,"Electric Vehicle (EV) Charging Rate Regulations, Regulated electric utilities must provide customers with a choice of
flat rate or time of use electricity rates specific to EV owners.
Investor-owned utilities may own and operate EV charging equipment using
its own funds or petition the Oregon Public Utilities Commission for
rate recovery.

(Reference [Oregon Revised Statutes 757.005](https://www.oregonlegislature.gov/) and [Public Utility Commission of Oregon, Order No. 12-013, 2012](http://apps.puc.state.or.us/edockets/ordselct.asp)), Laws and Regulations, 60.0, ELEC|PHEV, OTHER, AFP|OTHER, https://www.oregonlegislature.gov/|http://apps.puc.state.or.us/edockets/ordselct.asp, enacted"
2012,Tennessee,"Compressed Natural Gas (CNG) Permit, CNG dealers must apply for and obtain a permit from the Tennessee
Department of Revenue (Department). The permit authorizes the dealer to
collect and remit taxes on CNG delivered to motor vehicles by means of a
dispenser with meter capability. The permit will remain valid as long as
the dealer provides timely reports and remits taxes when due, or until
surrendered or cancelled. All CNG meters and dispensers are subject to
inspection and verification by the Tennessee Department of Agriculture's
Weights and Measures enforcement provisions.

A CNG vehicle user must apply for and obtain a CNG user's permit from
the Department unless the user purchases CNG from a dealer through a
metered dispenser.

For more information, see the Department's [CNG Tax Return for
Dealers](https://www.tn.gov/content/dam/tn/revenue/documents/notices/motorfuels/motorfuels13-02.pdf)
fact sheet and the [Motor Fuel
Taxes](https://www.tn.gov/revenue/taxes/motor-fuel-taxes/forms.html)
website.

(Reference [Tennessee Code 67-3-1119 and 67-3-1120](https://www.tncourts.gov/Tennessee%20Code)), Laws and Regulations, 85.0, NG, REGIS, STATION|IND, https://www.tncourts.gov/Tennessee%20Code, enacted"
2012,Rhode Island,"Petroleum Reduction Initiative, The Petroleum Savings and Independence Advisory Commission (Commission)
was established to provide recommendations and monitor programs designed
to reduce the state's dependence on petroleum-based fuels in the
transportation and heating sectors. Established targets may not provide
less than a 30% overall reduction in petroleum consumption from 2007
levels by 2030 and a 50% overall reduction from 2007 levels by 2050.
Recommendations will include those related to incentives, plug-in
electric vehicle deployment, implementation of a clean fuels standard,
and land use planning. The Commission must report on monitoring
activities to the General Assembly at least every two years. The
Commission must also continue to evaluate the state's progress toward
meeting petroleum-reduction goals and make recommendations to the
General Assembly as necessary.

(Reference [Rhode Island General Laws 42-140.4](http://webserver.rilin.state.ri.us/Statutes/)), Laws and Regulations, 36.0, ELEC|OTHER|PHEV, OTHER, OTHER, http://webserver.rilin.state.ri.us/Statutes/, enacted"
2013,Tennessee,"Natural Gas Station Property Tax Reduction, Any public utility, commercial, or industrial property certified to fuel
natural gas vehicles may not be valued for property tax purposes at more
than 30% of its total installed cost. The Tennessee Department of
Environment and Conservation must certify that the station uses
compressed or liquefied natural gas for the purpose of fueling motor
vehicles and displaces more than 6,000 gallons of petroleum annually.

(Reference [Tennessee Code 67-5-601 and 67-4-2004](https://www.tncourts.gov/Tennessee%20Code)), State Incentives, 10.0, NG, TAX, STATION|AFP|FLEET|GOV, https://www.tncourts.gov/Tennessee%20Code, enacted"
,Oklahoma,"Ethanol Sales Tax Exemption, The portion of ethanol sold and blended with motor fuel is exempt from
sales tax.
, State Incentives, 37.0, ETH, EXEM|TAX, STATION|PURCH|IND, http://www.oklegislature.gov/"
2013,Oklahoma,"Compressed Natural Gas (CNG) Fueling Infrastructure Inspection, The Oklahoma Department of Labor may access and inspect any equipment,
practices, or methods used in association with public CNG fueling
infrastructure.

(Reference [Oklahoma Statutes 40-142.2](http://www.oklegislature.gov/)), Laws and Regulations, 73.0, NG, OTHER, STATION|AFP, http://www.oklegislature.gov/, amended"
2013,Oregon,"State Agency Electric Vehicle (EV) Charging Station Installation, State agencies may install publicly accessible EV chargers on their
premises or contract with a vendor to do so. The Oregon Department of
Administrative Services (DAS) will establish criteria to determine the
appropriate number of locations for EV chargers at each agency. A state
agency may establish and adjust a uniform price for charging, provided
that the price recovers, to the extent practicable, the cost of
operating the EV charger and does not exceed 110% of the average market
price for the use of public EV chargers. DAS reported to the Legislative
Assembly on the number, cost, and utilization of EV chargers installed
by state agencies in [February
2019](https://www.oregonlegislature.gov/citizen_engagement/Reports/2018-DAS-Fleet%20and%20Parking%20Services.pdf),
[February
2021](https://www.oregonlegislature.gov/citizen_engagement/Reports/DAS%20Fleet%20ORS%20283%20343%20Biennial%20Report%202020%20Final.pdf),
and [February
2023](https://olis.oregonlegislature.gov/liz/2023R1/Downloads/CommitteeMeetingDocument/262613).

DAS must add electric vehicle (EV) charging capacity for employee and
public visitor parking lots, develop contracts to procure and install
charging infrastructure, and incorporate EV charging as a tenant
improvement for state-leased buildings.

(Reference [Oregon Revised Statutes 276.255](https://www.oregonlegislature.gov) and [Executive Order 17-21, 2017](http://www.oregon.gov/gov/admin/pages/executive-orders.aspx)), Laws and Regulations, 52.0, ELEC|PHEV, REQ, STATION, https://www.oregonlegislature.gov|https://www.oregonlegislature.gov|https://www.oregonlegislature.gov|http://www.oregon.gov/gov/admin/pages/executive-orders.aspx, amended"
2013,Oregon,"Electric Vehicle (EV) Charging Station Policies for Associations, The owner of a lot in a planned community or unit in a condominium may
apply to install EV charging stations for their personal use in a
parking space subject to the exclusive use of the owner. The homeowners
association (HOA) must approve a complete application within 60 days.
The owner is responsible for all costs associated with the EV charging
station installation and use, must disclose the existence of the EV
charging station and related responsibilities to a prospective buyer,
and must ensure that the infrastructure meets insurance and safety
requirements. EV charging stations installed under these regulations are
considered to be the personal property of the lot or unit owner with
which the EV charging station is associated, unless the owner and HOA
have negotiated a different outcome. Additional requirements and
restrictions apply.

(Reference [Oregon Revised Statutes 94.762 and 100.627](http://www.leg.state.or.us/ors/home.htm)), Laws and Regulations, 62.0, ELEC|PHEV, RTC, MUD|IND, http://www.leg.state.or.us/ors/home.htm, amended"
,Oregon,"Alternative Fuel Excise Tax, Compressed natural gas motor fuel is subject to the state fuel excise
tax at the rate of \$0.34 per 123.57 cubic feet. Liquefied petroleum gas
motor fuel is subject to the state fuel excise tax at the rate of \$0.34
per 1.353 gallons. Hydrogen motor fuel is subject to the state fuel
excise tax at the rate of \$0.34 per kilogram. Liquefied natural gas
motor fuel is subject to the state fuel excise tax at the rate of \$0.34
per 1.71 gallons.

(Reference [Oregon Revised Statutes 319.530](https://www.oregonlegislature.gov/)), Laws and Regulations, 115.0, HY|NG|LPG, FUEL, STATION|PURCH|FLEET|IND, https://www.oregonlegislature.gov/|https://www.oregonlegislature.gov/bills_laws"
2013,Oregon,"Zero Emission Vehicle (ZEV) Deployment Support, Oregon joined California, Connecticut, Maine, Maryland, Massachusetts,
New Jersey, New York, Rhode Island, and Vermont in signing a [memorandum
of
understanding](https://www.nescaum.org/documents/zev-mou-10-governors-signed-20191120.pdf/)
(MOU) to support the deployment of ZEVs through involvement in a ZEV
Program Implementation Task Force (Task Force). In May 2014, the Task
Force published a [ZEV Action
Plan](https://www.nescaum.org/documents/multi-state-zev-action-plan.pdf)
(Plan) identifying 11 priority actions to accomplish the goals of the
MOU, including deploying at least 3.3 million ZEVs and adequate fueling
infrastructure within the signatory states by 2025. The Plan also
includes a research agenda to inform future actions. On an annual basis,
each state must report on the number of registered ZEVs, the number of
public electric vehicle (EV) charger and hydrogen fueling stations, and
available information regarding workplace fueling for ZEVs.

In June 2018, the Task Force published a new [ZEV Action
Plan](https://www.nescaum.org/documents/2018-zev-action-plan.pdf) for
2018-2021. Building on the 2014 Action Plan, the 2018 Action Plan makes
recommendations for states and other key partners in five priority
areas:

-   Raising consumer awareness and interest in electric vehicle
    technology;
-   Building out a reliable and convenient residential, workplace and
    public charging/fueling infrastructure network;
-   Continuing and improving access to consumer purchase and
    non-financial incentives;
-   Expanding public and private sector fleet adoption; and
-   Supporting dealership efforts to increase ZEV sales.

For more information, see the [Multi-State ZEV Task
Force](https://www-f.nescaum.org/documents/multi-state-medium-and-heavy-duty-zero-emission-vehicle-action-plan/)
website.
, Laws and Regulations, 65.0, ELEC|HY|PHEV, AIRQEMISSIONS, OTHER, amended"
2013,Rhode Island,"Zero Emission Vehicle (ZEV) Deployment Support, Rhode Island joined California, Connecticut, Maine, Maryland,
Massachusetts, New Jersey, New York, Oregon, and Vermont in signing a
[memorandum of
understanding](https://www.nescaum.org/documents/zev-mou-10-governors-signed-20191120.pdf/)
(MOU) to support the deployment of ZEVs through involvement in a ZEV
Program Implementation Task Force (Task Force). In May 2014, the Task
Force published a [ZEV Action
Plan](https://www.nescaum.org/documents/multi-state-zev-action-plan.pdf)
(Plan) identifying 11 priority actions to accomplish the goals of the
MOU, including deploying at least 3.3 million ZEVs and adequate fueling
infrastructure within the signatory states by 2025. The Plan also
includes a research agenda to inform future actions. On an annual basis,
each state must report on the number of registered ZEVs, the number of
public electric vehicle supply equipment (EVSE) and hydrogen fueling
stations, and available information regarding workplace fueling for
ZEVs.

In June 2018, the Task Force published a new [ZEV Action
Plan](https://www.nescaum.org/documents/2018-zev-action-plan.pdf) for
2018-2021. Building on the 2014 Action Plan, the 2018 Action Plan makes
recommendations for states and other key partners in five priority
areas:

-   Raising consumer awareness and interest in electric vehicle
    technology;
-   Building out a reliable and convenient residential, workplace and
    public charging/fueling infrastructure network;
-   Continuing and improving access to consumer purchase and
    non-financial incentives;
-   Expanding public and private sector fleet adoption; and
-   Supporting dealership efforts to increase ZEV sales.

For more information, see the [Multi State ZEV Task
Force](https://www.nescaum.org/our-work/clean-transportation/adoption-of-electric-cars)
website.
, Laws and Regulations, 33.0, ELEC|HY|PHEV, AIRQEMISSIONS, OTHER, amended"
2013,Ohio,"Natural Gas Vehicle (NGV) and Electric Vehicle (EV) Weight Exemption, NGVs and EVs may exceed the gross vehicle weight restrictions by 2,000
pounds, except on the interstate system or a highway, road, or bridge
that is subject to maximum weight restrictions.

(Reference [Ohio Revised Code 5577.044](http://codes.ohio.gov/orc/)), State Incentives, 32.0, ELEC|NG, EXEM, FLEET|GOV|IND, https://ohiohouse.gov/|http://codes.ohio.gov/orc/|https://ohiohouse.gov/, amended"
2013,Ohio,"Natural Gas Measurement, Compressed natural gas (CNG) and liquefied natural gas (LNG) used for
transportation must be measured in gasoline gallon equivalents (GGE) or
diesel gallon equivalents (DGE). One DGE of LNG is the equivalent of one
gallon of motor fuel. One GGE of CNG is equal to 139.31 cubic feet or
6.38 pounds.

(Reference [Ohio Revised Code 5735.011](https://www.legislature.ohio.gov/)), Laws and Regulations, 70.0, NG, FUEL, STATION|AFP|PURCH|FLEET|GOV|IND, https://www.legislature.ohio.gov/|https://www.legislature.ohio.gov/|https://www.legislature.ohio.gov/|https://www.legislature.ohio.gov/, amended"
2011,Pennsylvania,"Aftermarket Alternative Fuel Vehicle (AFV) Conversion Requirements, Conventional original equipment manufacturer passenger vehicles and
light-duty trucks may be converted to operate on alternative fuels as a
dedicated or bi-fuel AFV. Vehicles altered to operate on propane,
natural gas, methane, ethanol, or electricity are classified as
aftermarket AFV conversions. All vehicle conversions must meet current
applicable U.S. Environmental Protection Agency or California Air
Resources Board standards for aftermarket conversions.

(Reference [Pennsylvania Department of Environmental Protection Policy on Clean Alternative Fuel Conversion Systems 270-0810-007](https://www.dep.pa.gov/Business/Air/BAQ/Automobiles/Documents/PCV%20Conversion%20Policy%20Final%20Revised.pdf)), Laws and Regulations, 60.0, AFTMKTCONV, AIRQEMISSIONS, MAN|FLEET|GOV|IND, https://www.dep.pa.gov/Business/Air/BAQ/Automobiles/Documents/PCV%20Conversion%20Policy%20Final%20Revised.pdf, enacted"
2014,Rhode Island,"Electric Drive Vehicle License Plates, The Rhode Island Division of Motor Vehicles (DMV) may issue special
vehicle license plates to owners of electric drive vehicles, including
those powered in whole or in part by a storage battery. Eligible
vehicles include hybrid electric, plug-in hybrid electric, and
all-electric vehicles registered as electric drive vehicles in the
state. For more information, including license plate fee, see the Rhode
Island DMV [Other
Plates](https://dmv.ri.gov/registrations-plates-titles/license-plates/other-plates)
website.

(Reference [Rhode Island General Laws 31-3-101](http://webserver.rilin.state.ri.us/Statutes/)), Laws and Regulations, 17.0, ELEC|HEV|PHEV, REGIS, FLEET|IND, http://webserver.rilin.state.ri.us/Statutes/, enacted"
2014,Rhode Island,"State Agency Coordination to Address Climate Change, The Rhode Island Executive Climate Change Coordinating Council (EC4) was
established to coordinate efforts between state agencies to reduce
greenhouse gas (GHG) emissions. The EC4 will pursue GHG emissions
reductions of 10% below 1990 levels by 2020, 45% below 1990 levels by
2035, and 80% below 1990 levels by 2050. State agencies must assist EC4
to develop programs to encourage state employees to reduce vehicle miles
traveled and use public transportation when available. The Council will
also work with municipalities to encourage sustainability; identify
federal, state, and private funding opportunities that can be leveraged
to reduce emissions in Rhode Island; and develop GHG emissions reduction
strategies. The Council submitted a
[plan](http://climatechange.ri.gov/documents/riggerr16.pdf) in December
2016 with suggested strategies for GHG emissions reduction activities to
the governor. The EC4 and the State Chief Resiliency Officer submitted a
statewide [Action Plan to Stand Up to Climate
Change](http://climatechange.ri.gov/resiliency/) and to the governor in
July 2018.

(Reference [Rhode Island General Laws 42-6.2](http://webserver.rilin.state.ri.us/Statutes/) and [Executive Order(PDF) 17-10, 2017](http://www.governor.ri.gov/documents/orders/ExecOrder-17-10-09152017.pdf)), Laws and Regulations, 31.0, AFTMKTCONV|BIOD|ETH|ELEC|EFFEC|HEV|HY|IR|NG|NEVS|OTHER|PHEV|LPG, AIRQEMISSIONS|CCEINIT, GOV, http://webserver.rilin.state.ri.us/legislation/|http://webserver.rilin.state.ri.us/Statutes/|http://www.governor.ri.gov/documents/orders/ExecOrder-17-10-09152017.pdf, enacted"
2014,Pennsylvania,"Neighborhood Electric Vehicle (NEV) Definition, A NEV is defined as a four-wheeled electric vehicle that has a maximum
speed greater than 20 miles per hour (mph) but not more than 25 mph. All
vehicles must comply with the safety standards established in Title 49
of the [U.S. Code of Federal
Regulations](https://www.govinfo.gov/app/collection/cfr), section
571.500. Drivers must maintain a defined level of insurance coverage for
all registered vehicles.

(Reference [Title 75 Pennsylvania Statutes Part I, Chapter 1, Section 102 and Part II, Chapter 17, Subchapter H, Section 1788](http://government.westlaw.com/linkedslice/default.asp?SP=pac-1000)), Laws and Regulations, 75.0, ELEC, DREST, IND, http://www.legis.state.pa.us/|http://government.westlaw.com/linkedslice/default.asp?SP=pac-1000, enacted"
1993,Rhode Island,"Electric Vehicle Emissions Inspection Exemption, Vehicles powered exclusively by electricity are exempt from state
emissions control inspections. For more information, see the [Rhode
Island Emissions and Safety Testing
Program](https://www.riinspection.org/Pages/Content.aspx?ID=1#:~:text=Electric%20vehicles%20are%20exempted%20from,inspection%20for%20safety%20and%20emissions.)
website.

(Reference [Rhode Island General Laws 31-47.1-5](http://webserver.rilin.state.ri.us/Statutes)), State Incentives, 7.0, ELEC, EXEM, FLEET|GOV|IND, http://webserver.rilin.state.ri.us/Statutes, enacted"
1996,Ohio,"Alternative Fuel Vehicle (AFV) Emissions Inspection Exemption, Vehicles powered exclusively by electricity, propane, or natural gas are
exempt from state motor vehicle emissions inspections after a one-time
verification inspection. For more information, see the Ohio
Environmental Protection Agency [E-Check](http://www.ohioecheck.info/)
website.

(Reference [Ohio Administrative Code 3745-26-1 and 3745-26-12](https://epa.ohio.gov/divisions-and-offices/air-pollution-control/e-check/01-waivers-extensions-and-exemptions)), State Incentives, 32.0, ELEC|NG|LPG, EXEM, FLEET|GOV|IND, https://epa.ohio.gov/divisions-and-offices/air-pollution-control/e-check/01-waivers-extensions-and-exemptions, enacted"
2013,Tennessee,"Idle Reduction Weight Exemption, Any motor vehicle equipped with qualified idle reduction technology or
other emissions reduction technology may exceed the state gross or axle
weight limits, by 550 pounds or the maximum amount allowed by federal
law, whichever is greater, to account for the weight of the technology.
The additional weight may not exceed the weight of the idle reduction
unit. The vehicle operator must also be able to demonstrate that the
technology is fully functional.

(Reference [Tennessee Code 55-7-203](https://www.tncourts.gov/Tennessee%20Code)), State Incentives, 15.0, IR, EXEM, FLEET|GOV|IND, https://www.tncourts.gov/Tennessee%20Code, enacted"
2015,Tennessee,"Natural Gas Measurement, Compressed natural gas (CNG) and liquefied natural gas (LNG) used for
transportation must be sold in gasoline gallon equivalents (GGE) or
diesel gallon equivalents (DGE) prescribed by the state, unless
equivalent measures are established by the National Conference on
Weights and Measures. According to current state law, one GGE is equal
to 5.66 pounds (lbs.) of CNG. One DGE is equal to 6.06 lbs. of LNG.

(Reference [Tennessee Code 47-26-914](https://www.tncourts.gov/Tennessee%20Code)), Laws and Regulations, 30.0, NG, FUEL, STATION, https://www.tncourts.gov/Tennessee%20Code, enacted"
2015,Oklahoma,"Compressed Natural Gas (CNG) Vehicle Loan Program Development, The Oklahoma Cooperative Circuit Engineering Districts Board must
develop and adopt rules and processes for a no-interest loan program to
allow qualified county governments to purchase or convert CNG vehicles.
Counties that borrow funds must sell to a nongovernmental entity or
properly dispose of a comparable number of conventional vehicles. Loan
terms will be up to five years.

(Reference [Oklahoma Statutes 69-687.3C](http://www.oklegislature.gov)), Laws and Regulations, 70.0, NG, OTHER, GOV, http://www.oklegislature.gov, enacted"
2015,Oklahoma,"Natural Gas Measurement, The Oklahoma Department of Labor (DOL) must standardize compressed
natural gas (CNG) and liquefied natural gas (LNG) measurements for
retail motor vehicle fuel, unless the National Conference on Weights and
Measures has established equivalent measures. Until the DOL standardizes
measurements, a gasoline gallon equivalent is equal to 5.66 pounds
(lbs.) of CNG and a diesel gallon equivalent is equal to 6.06 lbs. of
LNG.

(Reference [Oklahoma Statutes 83-119](http://www.oklegislature.gov)), Laws and Regulations, 71.0, NG, FUEL, STATION, http://www.oklegislature.gov, enacted"
