Year,State,Metadata
2005,Oregon,"Alternative Fuel Loans, The Oregon Department of Energy administers the Small-Scale Local Energy
Loan Program which offers low-interest loans for qualifying projects.
Eligible alternative fuel projects include fuel production facilities,
dedicated feedstock production, fueling infrastructure, and fleet
vehicles. Loan recipients must complete a loan application and pay a
loan application fee. For more information, see the [Energy Loan
Program](https://www.oregon.gov/energy/incentives/pages/energy-loan-program.aspx)
website.

(Reference [Oregon Revised Statutes 470](https://www.oregonlegislature.gov/bills_laws/Pages/ORS.aspx)), State Incentives, 11.0, BIOD|ETH|ELEC|EFFEC|HY|IR|NG|PHEV|LPG, LOANS, STATION|AFP|FLEET, https://www.oregonlegislature.gov/bills_laws/Pages/ORS.aspx, amended"
2005,Oregon,"Alternative Fuel Vehicle Acquisition (AFV) and Fuel Use Requirements, Beginning January 1, 2025, all new light-duty state agency fleet vehicle
purchases or leases must be all-electric, plug-in hybrid electric, or
hydrogen fuel cell vehicles, to the maximum extent possible. If
purchasing or leasing these vehicles is not feasible, state agencies may
purchase or lease light-duty AFVs or qualifying low-emission vehicles.
Each state agency must develop and report a greenhouse gas reduction
baseline and annual reduction targets to the Oregon Department of
Administrative Services (DAS). Reports to DAS must include the number of
purchases or leases of ZEVs, AFVs, and AFV conversions and the quantity
of each type of alternative fuel used annually by state agency fleets.

(Reference [Executive Order 20-04, 2020](https://www.oregon.gov/gov/Pages/executive-orders.aspx) and [Oregon Revised Statutes 267.030 and 283.327](https://www.oregonlegislature.gov/)), Laws and Regulations, 100.0, BIOD|ETH|ELEC|HY|NG|PHEV|LPG, REQ|CCEINIT, GOV, http://governor.oregon.gov/Gov/exec_orders.shtml|https://www.oregon.gov/gov/Pages/executive-orders.aspx|https://www.oregon.gov/gov/Pages/executive-orders.aspx|https://www.oregonlegislature.gov/|https://www.oregonlegislature.gov/bills_laws, amended"
,South Dakota,"Propane Tax Exemption, A licensed biodiesel producer may apply for and obtain a tax refund for
state fuel taxes paid on methanol used to produce biodiesel. For more
information, including how to apply, see the South Dakota Department of
Revenue [Motor Fuel Excise
Tax](https://dor.sd.gov/individuals/taxes/motor-fuel/) website.

(Reference [South Dakota Statutes 10-47B-167](http://sdlegislature.gov/Statutes/Codified_Laws/default.aspx)), State Incentives, 25.0, LPG, EXEM|TAX, STATION|PURCH|FLEET|IND, http://sdlegislature.gov/Statutes/Codified_Laws/default.aspx"
,Oklahoma,"Alternative Fuel Technician Training, The Alternative Fuels Technician Certification Act (Act) regulates the
training, testing, and certification of technicians and trainees who
install, modify, repair, or renovate equipment used in alternative
fueling infrastructure and in the conversion of any engine to operating
on an alternative fuel. Alternative fuels include propane, natural gas,
methanol, ethanol, electricity, hydrogen, biodiesel, and more. This
includes original equipment manufacturer engines dedicated to operating
on an alternative fuel. Electric vehicles (EVs), EV charging
infrastructure, and EV technicians must also comply with the rules and
regulations of this Act.

(Reference [Oklahoma Statutes 40-142.1 through 40-142.16](http://www.oklegislature.gov/)), Laws and Regulations, 110.0, AFTMKTCONV|BIOD|ETH|ELEC|HY|NG|PHEV|LPG, REGIS, STATION|MAN, http://www.oklegislature.gov/"
2001,Oregon,"Pollution Control Equipment Exemption, Dedicated original equipment manufacturer natural gas vehicles and
all-electric vehicles are not required to be equipped with a certified
pollution control system.

(Reference [Oregon Revised Statutes 815.300](https://www.oregonlegislature.gov/lc/Pages/ORSupdate.aspx)), State Incentives, 16.0, ELEC|NG, EXEM, FLEET|GOV|IND, https://www.oregonlegislature.gov/lc/Pages/ORSupdate.aspx, enacted"
1993,Ohio,"Alternative Fuel Vehicle Conversion, It is unlawful to tamper with vehicle emissions control systems unless
the action is for the purpose of converting a motor vehicle to operate
on an alternative fuel and is in compliance with the standards adopted
under the Clean Air Act Amendments.

(Reference [Ohio Revised Code 3704.16-3704.162](http://codes.ohio.gov/orc/)), Laws and Regulations, 80.0, AFTMKTCONV|BIOD|ETH|ELEC|HY|NG|PHEV|LPG, AIRQEMISSIONS, MAN|FLEET|GOV|IND, http://codes.ohio.gov/orc/, enacted"
,Pennsylvania,"Alternative Fuels Tax, Alternative fuels used to propel vehicles of any kind on public highways
are taxed at a rate determined on a gasoline gallon equivalent basis.
For more information, including applicable tax rates, see the
Pennsylvania Department of Revenue [Motor and Alternative Fuel
Taxes](https://www.revenue.pa.gov/TaxTypes/MAFT/Pages/default.aspx)
website. Certain exemptions apply.

(Reference [Title 75 Pennsylvania Statutes, Part VI, Chapter 90, Section 9004](http://government.westlaw.com/linkedslice/default.asp?SP=pac-1000)), Laws and Regulations, 70.0, BIOD|ETH|ELEC|HY|NG|PHEV|LPG, FUEL, STATION|PURCH, http://government.westlaw.com/linkedslice/default.asp?SP=pac-1000"
,Oklahoma,"Alternative Fuel Vehicle (AFV) Acquisition Requirements, All school and government fleets may convert their vehicles to operate
on alternative fuels, and all school districts should consider
purchasing only vehicles able to operate on alternative fuels.
Alternative fuels include natural gas, propane, ethanol, methanol,
electricity, biodiesel, hydrogen, and more. School and government
vehicles capable of operating on an alternative fuel must use the fuel
whenever a fueling station is located within a five-mile radius of the
respective school district or government department and the price of the
alternative fuel is cost competitive with the displaced conventional
fuel. If school and government vehicles must be fueled outside the
five-mile radius and no fueling station is reasonably available, the
school and government vehicles are exempt from this requirement.

(Reference [Oklahoma Statutes 74-130.2 and 74-130.3](http://www.oklegislature.gov/)), Laws and Regulations, 100.0, AFTMKTCONV|BIOD|ETH|ELEC|HY|NG|PHEV|LPG, REQ, FLEET|GOV, http://www.oklegislature.gov/"
2013,Oklahoma,"Alternative Fuel Vehicle (AFV) Tax and Fee, Compressed natural gas (CNG) used in motor vehicles is subject to a
state motor fuel tax of \$0.05 per gasoline gallon equivalent (GGE).
Liquefied natural gas (LNG) is also subject to a state motor fuel tax
rate of \$0.05 per diesel gallon equivalent (DGE).

In lieu of the motor fuel tax, some alternative fuel vehicle (AFV)
owners are subject to a motor vehicle fee. An annual flat fee applies to
passenger automobiles, pickup trucks, vans and heavy-duty vehicles using
propane, natural gas, methanol, or blends of 85% methanol and 15%
gasoline (M85). Propane and natural gas vehicles with a payload capacity
of less than 2,000 pounds (lbs.) are taxed at a rate of \$50 per vehicle
per year. Methanol and M85 vehicles with a payload capacity of less than
2,000 lbs. are taxed at a rate of \$100 per vehicle per year. Propane,
methanol, and M85 vehicles with a payload capacity greater than 2,000
lbs. are taxed at a rate of \$150 per vehicle per year. If the owner
acquires the vehicle or converts it to run on the alternative fuel after
July 1 of the tax year, the flat fee is half of the listed amount. AFVs
must display a decal that the Oklahoma Tax Commission issues on an
annual basis.

(Reference [Oklahoma Statutes 68-500.4 and 68-723](http://www.oklegislature.gov/)), Laws and Regulations, 105.0, NG|OTHER|LPG, FUEL, PURCH|FLEET|IND, http://www.oklegislature.gov/|http://www.oklegislature.gov/, amended"
,South Dakota,"Biodiesel Tax, Biodiesel and biodiesel blends are taxed at the state motor fuel excise
tax rate of \$0.28 per gallon. Beginning the fiscal quarter after which
a biodiesel production facility in the state reaches a name plate
capacity of at least 20 million gallons per year and fully produces at
least 10 million gallons of biodiesel within one year, the tax on
biodiesel and biodiesel blends is reduced to \$0.26 per gallon.
Biodiesel is defined as a fuel comprised of mono-alkyl esters of long
chain fatty acids derived from vegetable oils or animal fats. Biodiesel
must meet the requirements of
[ASTM](https://www.astm.org/Standard/index.html) Standard D6751 and the
U.S. Environmental Protection Agency registration and health effects
testing program, as written January 1, 2008. Biodiesel blends are
defined as blended special fuel containing a minimum of 5% biodiesel
(B5).

(Reference [South Dakota Statutes 10-47B-3 through 10-47B-10](http://sdlegislature.gov/Statutes/Codified_Laws/default.aspx)), Laws and Regulations, 50.0, BIOD, FUEL, PURCH, http://sdlegislature.gov/Statutes/Codified_Laws/default.aspx, amended"
,Tennessee,"Low- and Medium-Speed Vehicle Access to Roadways, A low-speed vehicle is any four-wheeled electric vehicle, excluding golf
carts, that achieves speeds of at least 20 miles per hour (mph) but not
more than 25 mph. Low-speed vehicles may access roadways with speed
limits of up to 35 mph. A medium-speed vehicle is any four-wheeled
electric or gasoline vehicle that has a maximum speed of over 30 mph,
but not more than 35 mph. Medium-speed vehicles may not operate on
interstate highways or on any road or street that has a posted speed
limit greater than 40 mph. Low- and medium-speed vehicles must comply
with the safety standards in Title 49 of the Code of Federal
Regulations, section 571.500.

(Reference [Tennessee Code 55-8-101 and 55-8-191](https://www.tncourts.gov/Tennessee%20Code)), Laws and Regulations, 90.0, NEVS, DREST, FLEET|GOV|IND, https://www.tncourts.gov/Tennessee%20Code"
,Rhode Island,"Biodiesel Tax Exemption, Biodiesel is exempt from the \$0.34 per gallon state motor fuel tax.
Biodiesel may be blended with other fuel for use in motor vehicles, but
only the biodiesel portion of the blended fuel is exempt. Biodiesel is
defined as fuel that is derived from vegetable oils or animal fats and
conforms to [ASTM](https://www.astm.org/Standard/index.html) Standard
D6751 specifications for use in diesel engines and results in employment
at a manufacturing facility for biodiesel fuel. Biodiesel must be
produced at a manufacturing facility in Rhode Island.

(Reference [Rhode Island General Laws 31-36-1(6)](http://webserver.rilin.state.ri.us/Statutes/)), State Incentives, 10.0, BIOD, EXEM|TAX, STATION|AFP|PURCH, http://webserver.rilin.state.ri.us/Statutes/, amended"
2004,Pennsylvania,"Alternative Fuel Vehicle (AFV) Rebate, The Pennsylvania Department of Environmental Protection (DEP) AFV
Program offers rebates to assist eligible residents with the cost of the
purchase or lease of new or qualifying pre-owned AFVs, including
all-electric vehicles (EVs), plug-in hybrid electric vehicles (PHEVs),
compressed natural gas (CNG) vehicles, electric motorcycles, and propane
vehicles. Applicants must meet income eligibility requirements for the
program and eligible AFV purchase price not exceed \$45,000. Rebates are
available in the following amounts:

  Vehicle Type                                               Rebate Amount
  ---------------------------------------------------------- ---------------
  EV (new or pre-owned)                                      \$3,000
  PHEV (new or pre-owned)                                    \$1,500
  CNG, Propane, and Electric Motorcycle (new or pre-owned)   \$500

An additional rebate of \$1,000 is available for all applicants that
meet the [low-income
requirement](https://aspe.hhs.gov/poverty-guidelines), as defined by the
U.S. Department of Health and Human Services. Applications much be
received within six months of vehicle purchase. Rebates are awarded on a
first-come, first-served basis. For more information, including forms
and detailed requirements and restrictions, see the [DEP AFV
Rebates](https://www.pa.gov/agencies/dep/programs-and-services/grants-loans-rebates/alternative-fuel-vehicle-rebates-for-consumers.html)
website.

(Reference [Title 73 Pennsylvania Statutes, Chapter 18E, Section 1647.3](https://www.legis.state.pa.us/cfdocs/legis/LI/Public/cons_index.cfm)), State Incentives, 15.0, ELEC|HY|NG|PHEV|LPG, RBATE, IND, https://www.legis.state.pa.us/cfdocs/legis/LI/Public/cons_index.cfm, amended"
,Oklahoma,"Alternative Fuel Vehicle (AFV) Tax Credit, For tax years beginning before December 31, 2028, a one-time income tax
credit is available for up to \$50,000 towards the cost of purchasing a
new original equipment manufactured AFV or converting a vehicle to
operate on an alternative fuel. Tax credit amounts vary depending in the
gross vehicle weight rating (GVWR) of the vehicle:

  GVWR                           Maximum Amount
  ------------------------------ ----------------
  6,000 pounds (lbs.) or below   \$5,500
  6,001 lbs. to 10,000 lbs.      \$9,000
  10,001 lbs. to 26,500 lbs.     \$26,000
  Greater than 26,501 lbs.       \$100,000

The state also provides a tax credit of 10% of the total vehicle cost,
up to \$1,500, if the incremental cost of a new AFV cannot be determined
or when an AFV is resold, as long as a tax credit has not been
previously taken on the vehicle. Equipment used for conversions must be
new, not previously used to modify or retrofit any vehicle, meet
applicable federal and state safety standards, and must be installed by
a state certified alternative fuels equipment technician. Eligible
alternative fuels include natural gas, propane, and hydrogen. Tax
credits may be carried forward for up to five years.

(Reference [Oklahoma Statutes 68-2357.22](http://www.oklegislature.gov/)), State Incentives, 10.0, AFTMKTCONV|HY|NG|LPG, TAX, MAN|FLEET|IND, http://www.oklegislature.gov/index.aspx|http://www.oklegislature.gov/index.aspx|http://www.oklegislature.gov/, amended"
,Oklahoma,"Alternative Fueling Infrastructure Tax Credit, For tax years beginning before December 31, 2028, a tax credit is
available for up to 45% of the cost of installing commercial alternative
fueling infrastructure. Eligible alternative fuels include natural gas,
propane, hydrogen, and electricity. The infrastructure must be new and
not previously installed or used to fuel alternative fuel vehicles. A
tax credit is also available for up to 50% of the cost of installing a
residential propane, compressed natural gas, or liquefied natural gas
fueling system for noncommercial purposes, up to \$2,500. The tax credit
may be carried forward for up to five years.

(Reference [Oklahoma Statutes 68-2357.22](http://www.oklegislature.gov/)), State Incentives, 15.0, ELEC|HY|NG|PHEV|LPG, TAX, STATION, http://www.oklegislature.gov/|http://www.oklegislature.gov/|http://www.oklegislature.gov/|http://www.oklegislature.gov/, amended"
,Tennessee,"Biofuel Quality Inspection and Testing, The Tennessee Department of Agriculture may inspect and test ethanol and
methanol under the Kerosene and Motor Fuels Quality Inspection Act of
1989.

(Reference [Tennessee Code 47-18-1306 and 54-1-136](https://www.tncourts.gov/Tennessee%20Code)), Laws and Regulations, 65.0, BIOD|ETH, STD, STATION, https://www.tncourts.gov/Tennessee%20Code"
2005,Rhode Island,"Alternative Fuel Vehicle (AFV) and Zero Emission Vehicle (ZEV) Acquisition Requirements, To reduce fuel consumption and pollution emissions, and purchase
vehicles that provide the best value on a life cycle cost basis, the
state must take the following actions:

-   At least 75% of state motor vehicle acquisitions must be AFVs, and
    the remaining 25% must be HEVs to the greatest extent possible. By
    2025, 25% of state motor vehicle acquisitions must be ZEVs;
-   All new light-duty trucks in the state fleet must achieve a minimum
    city fuel economy of 19 miles per gallon (mpg) and achieve at least
    a Low Emission Vehicle certification, and all new passenger vehicles
    in the state fleet must achieve a minimum city fuel economy of 23
    mpg;
-   All state agencies must purchase the most economical,
    fuel-efficient, and lowest emission vehicles appropriate to meet
    requirements and discourage the purchase of sport utility vehicles;
-   All state agencies must purchase low rolling resistance tires with
    superior tread life for state vehicles when possible; and
-   All state vehicles must be maintained according to manufacturer
    specifications, including specified tire pressures and ratings.

The state must also prepare an annual report to the governor on
compliance with these goals.

(Reference [Executive Order 15-17, 2015](http://www.energy.ri.gov/documents/leadbyexample/ExecOrder15-17.pdf) and [Executive Order 05-13, 2005](http://www.afdc.energy.gov/pdfs/Exec_order_5_13_green_clean_vehicles.pdf)), Laws and Regulations, 30.0, BIOD|ETH|ELEC|EFFEC|HEV|HY|NG|PHEV|LPG, REQ, GOV, http://www.energy.ri.gov/documents/leadbyexample/ExecOrder15-17.pdf|http://www.afdc.energy.gov/pdfs/Exec_order_5_13_green_clean_vehicles.pdf, amended"
,Oregon,"Low-Speed Vehicle and Medium-Speed Electric Vehicle (EV) Access to Roadways, A low-speed vehicle is defined as a four-wheeled motor vehicle capable
of reaching speeds of more than 20 miles per hour (mph) but not more
than 25 mph. A low-speed vehicle may not operate on a highway that has a
posted speed limit of more than 35 mph. A medium-speed EV is defined as
a four-wheeled electric motor vehicle that is equipped with a roll cage
or a crushproof body design and is capable of reaching speeds of up to
35 mph. A medium-speed EV may not operate on a highway that has a posted
speed limit of more than 45 mph. A city or county may adopt ordinances
that allow the operation of low-speed vehicles or medium-speed EVs on
city streets or county roads that have posted speed limits greater than
35 mph and 45 mph, respectively. Low-speed vehicles and medium-speed EVs
must comply with certain standards contained in Title 49 of the [U.S.
Code of Federal
Regulations](https://www.govinfo.gov/app/collection/uscode), section
571.500.

(Reference [Oregon Revised Statutes 801.331, 801.341, and 811.512-811.513](http://www.leg.state.or.us/ors/home.htm) and [Oregon Administrative Rules 737-010-0010](http://sos.oregon.gov/archives/Pages/oregon_administrative_rules.aspx)), Laws and Regulations, 110.0, NEVS, DREST, FLEET|GOV|IND, http://www.leg.state.or.us/ors/home.htm|http://sos.oregon.gov/archives/Pages/oregon_administrative_rules.aspx, amended"
,Pennsylvania,"Alternative Fuel and Idle Reduction Grants, The Small Business Advantage Grant Program provides matching grants of
up to 80% of project costs, up to \$12,000, to enable a Pennsylvania
small business to adopt or acquire energy-efficient or pollution
prevention processes or equipment. Pennsylvania trucking companies and
independent truckers may use the funding to purchase U.S. Environmental
Protection Agency SmartWay verified anti-idling technologies. Projects
may not begin until applications are approved. Grants are available on a
first-come, first-served basis. For more information, see the [Small
Business Advantage Grant
Program](https://www.dep.pa.gov/Citizens/GrantsLoansRebates/SmallBusinessOmbudsmanOffice/Pages/Small%20Business%20Advantage%20Grant.aspx)
website.
, State Incentives, 20.0, EFFEC|IR, GNT, FLEET"
,Tennessee,"Propane and Natural Gas Liability Immunity, An individual or entity that supplies, handles, transports, or sells
propane or natural gas at a retail station is immune from civil
liability if incorrect use of the fueling equipment causes injury or
damage. To be immune, the fuel provider must exercise reasonable care of
the equipment and take reasonable steps to warn the customer of the
hazards associated with misuse of the equipment.

(Reference [Tennessee Code 29-34-202 and 29-34-207](https://www.tncourts.gov/Tennessee%20Code)), Laws and Regulations, 70.0, LPG, REGIS, STATION, https://www.tncourts.gov/Tennessee%20Code"
,Oklahoma,"Ethanol Fuel Retailer Tax Credit, Retailers that sell fuel blends of gasoline containing up to 15% ethanol
by volume (E15) are eligible for a motor fuel tax credit of \$0.016 per
gallon of ethanol blended into gasoline and sold in Oklahoma, as long as
the retailer provides a price reduction to the purchaser of the ethanol
fuel in the same amount. This incentive is effective unless the federal
government mandates the use of reformulated fuel in an area within
Oklahoma that is in nonattainment with the National Ambient Air Quality
Standards.
, State Incentives, 35.0, ETH, TAX, STATION, http://www.oklegislature.gov/"
,Rhode Island,"Idle Reduction Requirement, Motor vehicles may not idle unnecessarily for longer than five
consecutive minutes during any 60-minute period. This includes
heavy-duty diesel vehicles used to perform any state public works
contracts. Unnecessary idling does not include circumstances exempted by
regulations the Rhode Island Department of Environmental Management
(DEM) has adopted, such as when it is necessary to operate heating and
cooling equipment to ensure the health or safety of drivers and
passengers. Other vehicles exempt from these requirements include, but
are not limited to, the following:

-   Emergency response, public safety, or military vehicles
-   Armored vehicles being loaded or unloaded
-   Non-road vehicles
-   Vehicles making deliveries of fuel or energy products.

Violators of these regulations will be fined up to \$100 for the first
offense and up to \$500 for each succeeding offense.

(Reference [Rhode Island General Laws 23-23-29.2, 31-16.1 and 31-41.1-4](http://webserver.rilin.state.ri.us/Statutes/)), Laws and Regulations, 40.0, IR, AIRQEMISSIONS|DREST, FLEET|GOV|IND, http://webserver.rilin.state.ri.us/Statutes/, amended"
,Rhode Island,"Zero Emission Vehicle (ZEV) Sales Requirements and Low Emission Vehicle (LEV) Standards, Rhode Island has adopted the California motor vehicle emissions
standards and compliance requirements specified in Title 13 of the
[California Code of Regulations](https://oal.ca.gov/). These regulations
apply to passenger vehicles, light-duty trucks, and medium-duty
vehicles. Manufacturers must meet the [greenhouse gas emissions
standard](https://www.afdc.energy.gov/laws/6493) and the [ZEV production
and sales requirements](%20https://www.afdc.energy.gov/laws/4249).

(Reference [Rhode Island Department of Environmental Management Regulation Chapter 12-05-37](http://www.dem.ri.gov/pubs/regs/index.htm)), Laws and Regulations, 25.0, OTHER, AIRQEMISSIONS, MAN, http://www.dem.ri.gov/pubs/regs/index.htm"
2006,Ohio,"Diesel Emissions Reduction Grant Program, The Ohio Environmental Protection Agency (Ohio EPA) provides Diesel
Emissions Reduction Grants (DERG) for projects that reduce emissions by
retiring and replacing diesel public transit buses. Eligible projects
must achieve a minimum funding match of 20% from non-state and
non-federal sources. Funding for this program is provided by the U.S.
Department of Transportation Federal Highway Administration's
[Congestion Mitigation and Air Quality Improvement (CMAQ)
Program](https://www.fhwa.dot.gov/environment/air_quality/cmaq/). For
more information, including application periods, see the Ohio EPA
[DERG](https://epa.ohio.gov/divisions-and-offices/environmental-education/grant-programs/diesel-emission-reduction-grants)
website.

(Reference [Ohio Revised Code 122.861](http://codes.ohio.gov/orc/)), State Incentives, 30.0, BIOD|ETH|ELEC|HEV|IR|NG|LPG, GNT, STATION|MAN|FLEET|GOV, http://codes.ohio.gov/orc/, enacted"
2003,Ohio,"Alternative Fuel Vehicle Acquisition and Fuel Use Requirements, With the exception of law enforcement vehicles, all newly acquired state
agency vehicles must be capable of using an alternative fuel and must
use the relevant alternative fuel if it is reasonably priced and
available. Alternative fuel is defined as any fuel containing 85% or
more ethanol (E85), fuel blends containing at least 20% biodiesel (B20),
natural gas, propane, hydrogen, electricity, or any other fuel that the
U.S. Department of Energy has determined is substantially not petroleum.
State agencies must also meet the annual average fuel economy
requirement set by the Ohio Department of Administrative Services on all
passenger automobiles purchased. Law enforcement and emergency rescue
work vehicles are exempt from this requirement. The Office of the Ohio
Treasurer established a biodiesel revolving fund in which funds
appropriated by the Ohio General Assembly can be used to pay for the
incremental cost of biodiesel used in state owned or leased diesel
vehicles.

(Reference [Ohio Revised Code 125.831-125.836](https://codes.ohio.gov/ohio-revised-code)), Laws and Regulations, 60.0, BIOD|ETH|ELEC|HY|NG|PHEV|LPG, REQ, GOV, https://codes.ohio.gov/ohio-revised-code, amended"
,South Dakota,"Ethanol Blend Definition, An ethanol blend is defined as a blended motor fuel containing ethyl
alcohol that is at least 99% pure, derived from agricultural products,
and blended exclusively with gasoline.

(Reference [South Dakota Statutes 10-47B-3](https://sdlegislature.gov/Statutes/Codified_Laws)), Laws and Regulations, 70.0, ETH, STD, STATION|AFP|PURCH, https://sdlegislature.gov/Statutes/Codified_Laws, amended"
